Start time	Interlocutor	Speech	End time	Interruptions	Absolute time start	Absolute time end				
(0:21:31.9)	TRUMP:	Well, look, could I just finish — I think- I think I should-	(0:21:34.6)	x						
(0:21:32.1)	HOLT:	(INAUDIBLE) Actually- actually I need you- we need- you're- I'm going to give you a chance right here…	(0:21:36.4)	x						
(0:21:35.3)	TRUMP:	You go to her website, and you take a look at her website.	(0:21:38.1)	x						
(0:21:36.6)	HOLT:	… with a new 15-minute segment…	(0:21:37.9)	x						
(0:21:38.4)	TRUMP:	She’s going to raise taxes $1.3 trillion.	(0:21:41.4)							
(0:21:41.2)	HOLT:	Mr. Trump, I’m going to…	(0:21:42.0)	x						
(0:21:41.8)	TRUMP:	And look at her website. You know what? It’s no different than this. She’s telling us how to fight ISIS. Just go to her website. She tells you how to fight ISIS on her website. I don’t think General Douglas MacArthur would like that too much.	(0:21:53.3)	x						
(0:21:53.0)	HOLT:	Alright. The next segment, we’re continuing the subject about…	(0:21:56.3)	x						
(0:21:55.7)	CLINTON:	Well, at least I have a plan to fight ISIS.	(0:21:58.4)	x						
(0:21:57.9)	HOLT:	… achieving prosperity…	(0:21:59.2)	x						
(0:21:58.6)	TRUMP:	No, no, you’re telling the enemy everything you want to do.	(0:22:01.2)	x						
(0:22:01.4)	CLINTON:	No, we’re not. No, we’re not.	(0:22:03.1)							
(0:22:02.2)	TRUMP:	See, you’re telling the enemy everything you want to do. No wonder you’ve been fighting-	(0:22:05.7)	x						
(0:22:03.9)	CLINTON:	We're- we are (INAUDIBLE).	(0:22:05.9)	x						
(0:22:06.4)	TRUMP:	... no wonder you’ve been fighting ISIS your entire adult life.	(0:22:10.0)							
(0:22:11.1)	HOLT:	Folks- let me- let's	(0:22:12.2)							
(0:22:11.1)	CLINTON:	Well, that’s a — that’s — go to the — please, the fact checkers, get to work.	(0:22:14.8)	x						
(0:22:14.4)	HOLT:	OK, you are unpacking a lot here. And we’re still on the issue of achieving prosperity. And I want to talk about- taxes. The fundamental difference between the two of you concerns the wealthy. Secretary Clinton, you’re calling for a tax increase on the wealthiest Americans. I’d like you to further defend that. And, Mr. Trump, you’re calling for tax cuts for the wealthy. I’d like you to defend that. And this next two-minute answer goes to you, Mr. Trump.	(0:22:36.7)	x						
(0:22:36.7)	TRUMP:	Well, I’m really calling for major jobs, because the wealthy are going create tremendous jobs. They’re going to expand their companies. They’re going to do a tremendous job. I’m getting rid of the carried interest provision. And if you really look, it’s not a tax — it's really not a great thing for the wealthy. It’s a great thing for the middle class. It’s a great thing for companies to expand. And when these people are going to put billions and billions of dollars into companies, and when they’re going to bring $2.5 trillion back from overseas, where they can’t bring the money back, because politicians like Secretary Clinton won’t allow them to bring the money back, because the taxes are so onerous, and the bureaucratic red tape, so what — is so bad. So what they’re doing is they’re leaving our country, and they’re, believe it or not, leaving because taxes are too high and because some of them have lots of money outside of our country. And instead of bringing it back and putting the money to work, because they can’t work out a deal to — and everybody agrees it should be brought back. Instead of that, they’re leaving our country to get their money, because they can’t bring their money back into our country, because of bureaucratic red tape, because they can’t get together. Because we have — we have a president that can’t sit them around a table and get them to approve something. And here’s the thing. Republicans and Democrats agree that this should be done, $2.5 trillion. I happen to think it’s double that. It’s probably $5 trillion that we can’t bring into our country, Lester. And with a little leadership, you’d get it in here very quickly, and it could be put to use on the inner cities and lots of other things, and it would be beautiful. But we have no leadership. And honestly, that starts with Secretary Clinton.	(0:24:14.9)							
(0:24:15.5)	HOLT:	All right. You have two minutes of the same question to defend tax increases on the wealthiest Americans, Secretary Clinton.	(0:24:21.0)							
(0:24:21.1)	CLINTON:	I have a feeling that by, the end of this evening, I’m going to be blamed for everything that’s ever happened.	(0:24:25.7)							
(0:24:25.6)	TRUMP:	Why not?	(0:24:25.8)	x						
(0:24:26.3)	CLINTON:	Why not? Yeah, why not? (LAUGHTER) You know, just join the debate by saying more crazy things. Now, let me say this, it is absolutely the case…	(0:24:39.3)							
(0:24:35.7)	TRUMP:	There’s nothing crazy about not letting our companies bring their money back into their country.	(0:24:41.3)	x						
(0:24:40.2)	CLINTON:	It...	(0:24:40.4)	x						
(0:24:40.7)	HOLT:	This is — this is Secretary Clinton’s two minutes, please.	(0:24:43.3)							
(0:24:42.8)	TRUMP:	Yes.	(0:24:43.1)	x						
(0:24:44.0)	CLINTON:	Yeah, well, let’s start the clock again, Lester. We’ve looked at your tax proposals. I don’t see changes in the corporate tax rates or the kinds of proposals you’re referring to that would cause the repatriation, bringing back of money that’s stranded overseas. I happen to support that.	(0:25:04.2)							
(0:25:03.6)	TRUMP:	Then you didn’t read it.	(0:25:04.4)	x						
(0:25:04.8)	CLINTON:	I happen to — I happen to support that in a way that will actually work to our benefit. But when I look at what you have proposed, you have what is called now the Trump loophole, because it would so advantage you and the business you do. You’ve proposed an approach that has a…	(0:25:24.4)							
(0:25:22.1)	TRUMP:	Who gave it that name? The first I’ve ever— who gave it that name?	(0:25:24.7)	x						
(0:25:24.7)	HOLT:	This is-, this is Secretary Clinton’s two minutes.	(0:25:26.6)							
(0:25:24.7)	CLINTON:	… $4 billion tax benefit for your family. And when you look at what you are proposing…	(0:25:32.2)	x						
(0:25:31.0)	TRUMP:	How much? How much for my family?	(0:25:32.2)	x						
(0:25:32.5)	CLINTON:	… it is...	(0:25:33.2)							
(0:25:33.2)	TRUMP:	Lester, how much?	(0:25:33.8)							
(0:25:33.7)	CLINTON:	… as I said, trumped-up trickle-down. Trickle-down did not work. It got us into the mess we were in, in 2008 and 2009. Slashing taxes on the wealthy hasn’t worked. And a lot of really smart, wealthy people know that. And they are saying, hey, we need to do more to make the contributions we should be making to rebuild the middle class. I don’t think top-down works in America. I think building the middle class, investing in the middle class, making college debt-free so more young people can get their education, helping people refinance their tax— their debt from college at a lower rate. Those are the kinds of things that will really boost the economy. Broad-based, inclusive growth is what we need in America, not more advantages for people at the very top.	(0:26:25.7)	x						
(0:26:27.2)	HOLT:	Mr. Trump, we’re…	(0:26:28.1)							
(0:26:27.8)	TRUMP:	Typical politician. All talk, no action. Sounds good, doesn’t work. Never going to happen. Our country is suffering because people like Secretary Clinton have made such bad decisions in terms of our jobs and in terms of what’s going on. Now, look, we have the worst revival of an economy since the Great Depression. And believe me: We’re in a bubble right now. And the only thing that looks good is the stock market, but if you raise interest rates even a little bit, that’s going to come crashing down. We are in a big, fat, ugly bubble. And we better be awfully careful. And we have a Fed that’s doing political things. This Janet Yellen of the Fed. The Fed is doing political — by keeping the interest rates at this level. And believe me: The day Obama goes off, and he leaves, and goes out to the golf course for the rest of his life to play golf, when they raise interest rates, you’re going to see some very bad things happen, because the Fed is not doing their job. The Fed is being more political than Secretary Clinton.	(0:27:32.6)	x						
(0:27:32.8)	HOLT:	Mr. Trump, we’re talking about the burden that Americans have to pay, yet you have not released your tax returns. And the reason nominees have released their returns for decades is so that voters will know if their potential president owes money to — who he owes it to and any business conflicts. Don’t Americans have a right to know if there are any conflicts of interest?	(0:27:53.5)							
(0:27:53.6)	TRUMP:	I don’t mind releasing — I’m under a routine audit. And it’ll be released. And — as soon as the audit’s finished, it will be released. But you will learn more about Donald Trump by going down to the federal elections, where I filed a 104-page essentially financial statement of sorts, the forms that they have. It shows income — in fact, the income — I just looked today — the income is filed at $694 million for this past year, $694 million. If you would have told me I was going to make that 15 or 20 years ago, I would have been very surprised. But that’s the kind of thinking that our country needs. When we have a country that’s doing so badly, that’s being ripped off by every single country in the world, it’s the kind of thinking that our country needs, because everybody — Lester, we have a trade deficit with all of the countries that we do business with, of almost $800 billion a year. You know what that is? That means, who’s negotiating these trade deals? We have people that are political hacks negotiating our trade deals.	(0:28:58.8)							
(0:28:58.7)	HOLT:	The IRS says an audit…	(0:29:00.0)	x						
(0:28:59.4)	TRUMP:	Excuse me.	(0:28:59.8)	x						
(0:29:00.2)	HOLT:	… of your taxes — you’re perfectly free to release your taxes during an audit. And so the question, does the public’s right to know outweigh your personal…	(0:29:09.2)							
(0:29:09.2)	TRUMP:	Well, I told you, I will release them as soon as the audit. Look, I’ve been under audit almost for 15 years. I know a lot of wealthy people that have never been audited. I said, do you get audited? I get audited almost every year. And in a way, I should be complaining. I’m not even complaining. I don’t mind it. It’s almost become a way of life. I get audited by the IRS. But other people don’t. I will say this. We have a situation in this country that has to be taken care of. I will release my tax returns — against my lawyer’s wishes — when she releases her 33,000 e-mails that have been deleted. As soon as she releases them, I will release. (APPLAUSE) I will release my tax returns. And that’s against — my lawyers, they say, “Don’t do it.” I will tell you this. No — in fact, watching shows, they’re reading the papers. Almost every lawyer says, you don’t release your returns until the audit’s complete. When the audit’s complete, I’ll do it. But I would go against them if she releases her e-mails.	(0:30:09.6)							
(0:30:09.5)	HOLT:	So it’s negotiable?	(0:30:10.1)	x						
(0:30:11.6)	TRUMP:	It’s not negotiable, no. Let her release the e-mails. Why did she delete 33,000…	(0:30:15.4)							
(0:30:15.3)	HOLT:	Well, I’ll let her answer that. But let me just admonish the audience one more time. There was an agreement. We did ask you to be silent, so it would be helpful for us. Secretary Clinton?	(0:30:22.8)	x						
(0:30:23.7)	CLINTON:	Well, I think you’ve seen another example of bait-and-switch here. For 40 years, everyone running for president has released their tax returns. You can go and see nearly, I think, 39, 40 years of our tax returns, but everyone has done it. We know the IRS has made clear there is no prohibition on releasing it when you’re under audit. So you’ve got to ask yourself, why won’t he release his tax returns? And I think there may be a couple of reasons. First, maybe he’s not as rich as he says he is. Second, maybe he’s not as charitable as he claims to be. Third, we don’t know all of his business dealings, but we have been told through investigative reporting that he owes about $650 million to Wall Street and foreign banks. Or maybe he doesn’t want the American people, all of you watching tonight, to know that he’s paid nothing in federal taxes, because the only years that anybody’s ever seen were a couple of years when he had to turn them over to state authorities when he was trying to get a casino license, and they showed he didn’t pay any federal income tax. So...	(0:31:34.5)							
(0:31:34.8)	TRUMP:	That makes me smart.	(0:31:35.4)							
(0:31:34.9)	CLINTON:	... if he’s paid zero, that means zero for troops, zero for vets, zero for schools or health. And I think probably he’s not all that enthusiastic about having the rest of our country see what the real reasons are, because it must be something really important, even terrible, that he’s trying to hide. And the financial disclosure statements, they don’t give you the tax rate. They don’t give you all the details that tax returns would. And it just seems to me that this is something that the American people deserve to see. And I have no reason to believe that he’s ever going to release his tax returns, because there’s something he’s hiding. And we’ll guess. We’ll keep guessing at what it might be that he’s hiding. But I think the question is, were he ever to get near the White House, what would be those conflicts? Who does he owe money to? Well, he owes you the answers to that, and he should provide them.	(0:32:38.0)	x						
(0:32:38.2)	HOLT:	He also — he also raised the issue of your e-mails. Do you want to respond to that?	(0:32:41.6)							
(0:32:42.1)	CLINTON:	I do. You know, I made a mistake using a private e-mail.	(0:32:46.4)							
(0:32:46.5)	TRUMP:	That’s for sure.	(0:32:47.1)							
(0:32:47.2)	CLINTON:	And if I had to do it over again, I would, obviously, do it differently. But I’m not going to make any excuses. It was a mistake, and I take responsibility for that.	(0:32:56.9)							
(0:32:57.6)	HOLT:	Mr. Trump?	(0:32:57.9)							
(0:33:00.1)	TRUMP:	That was more than a mistake. That was done purposely. OK? That was not a mistake. That was done purposely. When you have your staff taking the Fifth Amendment, taking the Fifth so they’re not prosecuted, when you have the man that set up the illegal server taking the Fifth, I think it’s disgraceful. And believe me, this country thinks it’s disgrace— it really thinks it’s disgraceful, also. As far as my tax returns, you don’t learn that much from tax returns. That I can tell you. You learn a lot from financial disclosure. And you should go down and take a look at that. The other thing, I’m extremely underleveraged. The report that said $650 — which, by the way, a lot of friends of mine that know my business say, boy, that’s really not a lot of money. It’s not a lot of money relative to what I had. The buildings that were in question, they said in the same report, which was — actually, it wasn’t even a bad story, to be honest with you, but the buildings are worth $3.9 billion. And the $650 isn’t even on that. But it’s not $650. It’s much less than that. But I could give you a list of banks, I would — if that would help you, I would give you a list of banks. These are very fine institutions, very fine banks. I could do that very quickly. I am very underleveraged. I have a great company. I have a tremendous income. And the reason I say that is not in a braggadocios way. It’s because it’s about time that this country had somebody running it that has an idea about money. When we have $20 trillion in debt, and our country’s a mess, you know, it’s one thing to have $20 trillion in debt and our roads are good and our bridges are good and everything’s in great shape, our airports. Our airports are like from a third world country. You land at LaGuardia, you land at Kennedy, you land at LAX, you land at Newark, and you come in from Dubai and Qatar and you see these incredible — you come in from China, you see these incredible airports, and you land — we’ve become a third world country. So the worst of all things has happened. We owe $20 trillion, and we’re a mess. We haven’t even started. And we’ve spent $6 trillion in the Middle East, according to a report that I just saw. Whether it’s 6 or 5, but it looks like it’s 6, $6 trillion in the Middle East, we could have rebuilt our country twice. And it’s really a shame. And it’s politicians like Secretary Clinton that have caused this problem. Our country has tremendous problems. We’re a debtor nation. We’re a serious debtor nation. And we have a country that needs new roads, new tunnels, new bridges, new airports, new schools, new hospitals. And we don’t have the money, because it’s been squandered on so many of your ideas.	(0:35:38.2)							
(0:35:38.4)	HOLT:	We’ll let you respond and we’ll move on to the next-	(0:35:39.8)							
(0:35:38.4)	CLINTON:	And maybe because you haven’t paid any federal income tax for a lot of years. (APPLAUSE) And the other thing I think is important to point out...	(0:35:46.4)	x						
(0:35:45.9)	TRUMP:	It would be squandered, too, believe me.	(0:35:47.7)	x						
(0:35:47.0)	CLINTON:	… is if your — if your main claim to be president of the United States is your business, then I think we should talk about that. You know, your campaign manager said that you built a lot of businesses on the backs of little guys. And, indeed, I have met a lot of the people who were stiffed by you and your businesses, Donald. I’ve met dishwashers, painters, architects, glass installers, marble installers, drapery installers, like my dad was, who you refused to pay when they finished the work that you asked them to do. We have an architect in the audience who designed one of your clubhouses at one of your golf courses. It’s a beautiful facility. It immediately was put to use. And you wouldn’t pay what the man needed to be paid, what he was charging you to do…	(0:36:45.8)	x						
(0:36:45.3)	TRUMP:	Maybe he didn’t do a good job and I was unsatisfied with his work…	(0:36:48.7)	x						
(0:36:47.3)	CLINTON:	Well, do…	(0:36:48.4)	x						
(0:36:49.3)	TRUMP:	Which our country should do, too.	(0:36:50.5)							
(0:36:48.7)	CLINTON:	Do thousands- do the thousands of people that you have stiffed over the course of your business not deserve some kind of apology from someone who has taken their labor, taken the goods that they produced, and then refused to pay them? I can only say that I’m certainly relieved that my late father never did business with you. He provided a good middle-class life for us, but the people he worked for, he expected the bargain to be kept on both sides. And when we talk about your business, you’ve taken business bankruptcy six times. There are a lot of great businesspeople that have never taken bankruptcy once. You call yourself the King of Debt. You talk about leverage. You even at one time suggested that you would try to negotiate down the national debt of the United States.	(0:37:44.4)	x						
(0:37:42.0)	TRUMP:	Wrong. Wrong.	(0:37:43.9)	x						
(0:37:44.9)	CLINTON:	Well, sometimes there’s not a direct transfer of skills from business to government, but sometimes what happened in business would be really bad for government.	(0:37:56.6)							
(0:37:56.8)	HOLT:	Let’s let Mr. Trump…	(0:37:57.5)							
(0:37:57.1)	CLINTON:	And we need to be very clear about that.	(0:37:59.7)	x						
(0:37:57.6)	TRUMP:	So, yeah, I think it's— I do think it’s time. Look, it’s all words, it’s all sound bites. I built an unbelievable company. Some of the greatest assets anywhere in the world, real estate assets anywhere in the world, beyond the United States, in Europe, lots of different places. It’s an unbelievable company. But on occasion, four times, we used certain laws that are there. And when Secretary Clinton talks about people that didn’t get paid, first of all, they did get paid a lot, but taken advantage of the laws of the nation. Now, if you want to change the laws, you’ve been there a long time, change the laws. But I take advantage of the laws of the nation because I’m running a company. My obligation right now is to do well for myself, my family, my employees, for my companies. And that’s what I do. But what she doesn’t say is that tens of thousands of people that are unbelievably happy and that love me. I’ll give you an example. We’re just opening up on Pennsylvania Avenue right next to the White House, so if I don’t get there one way, I’m going to get to Pennsylvania Avenue another. But we’re opening the Old Post Office. Under budget, ahead of schedule, saved tremendous money. I’m a year ahead of schedule. And that’s what this country should be doing. We build roads and they cost two and three and four times what they’re supposed to cost. We buy products for our military and they come in at costs that are so far above what they were supposed to be, because we don’t have people that know what they’re doing. When we look at the budget, the budget is bad to a large extent because we have people that have no idea as to what to do and how to buy. The Trump International is way under budget and way ahead of schedule. And we should be able to do that for our country.	(0:39:52.2)	x						
(0:39:51.6)	HOLT:	Well, we’re well behind schedule, so I want to move to our next segment. We move into our next segment talking about America’s direction. And let’s start by talking about race. The share of Americans who say race relations are bad in this country is the highest it’s been in decades, much of it amplified by shootings of African-Americans by police, as we’ve seen recently in Charlotte and Tulsa. Race has been a big issue in this campaign, and one of you is going to have to bridge a very wide and bitter gap. So how do you heal the divide? Secretary Clinton, you get two minutes on this.	(0:40:22.2)	x						
(0:40:23.0)	CLINTON:	Well, you’re right. Race remains a significant challenge in our country. Unfortunately, race still determines too much, often determines where people live, determines what kind of education in their public schools they can get, and, yes, it determines how they’re treated in the criminal justice system. We’ve just seen those two tragic examples in both Tulsa and Charlotte. And we’ve got to do several things at the same time. We have to restore trust between communities and the police. We have to work to make sure that our police are using the best training, the best techniques, that they’re well prepared to use force only when necessary. Everyone should be respected by the law, and everyone should respect the law. Right now, that’s not the case in a lot of our neighborhoods. So I have, ever since the first day of my campaign, called for criminal justice reform. I’ve laid out a platform that I think would begin to remedy some of the problems we have in the criminal justice system. But we also have to recognize, in addition to the challenges that we face with policing, there are so many good, brave police officers who equally want reform. So we have to bring communities together in order to begin working on that as a mutual goal. And we’ve got to get guns out of the hands of people who should not have them. The gun epidemic is the leading cause of death of young African-American men, more than the next nine causes put together. So we have to do two things, as I said. We have to restore trust. We have to work with the police. We have to make sure they respect the communities and the communities respect them. And we have to tackle the plague of gun violence, which is a big contributor to a lot of the problems that we’re seeing today.	(0:42:29.9)							
(0:42:30.0)	HOLT:	All right, Mr. Trump, you have two minutes. How do you heal the divide?	(0:42:32.3)							
