Start time	Interlocutor	Speech	End time	Interruptions	Absolute time start	Absolute time end				
NA	HOLT:	Good evening from Hofstra University in Hempstead, New York. I’m Lester Holt, anchor of “NBC Nightly News.” I want to welcome you to the first presidential debate. The participants tonight are Donald Trump and Hillary Clinton. This debate is sponsored by the Commission on Presidential Debates, a nonpartisan, nonprofit organization. The commission drafted tonight’s format, and the rules have been agreed to by the campaigns. The 90-minute debate is divided into six segments, each 15 minutes long. We’ll explore three topic areas tonight: Achieving prosperity; America’s direction; and securing America. At the start of each segment, I will ask the same lead-off question to both candidates, and they will each have up to two minutes to respond. From that point until the end of the segment, we’ll have an open discussion. The questions are mine and have not been shared with the commission or the campaigns. The audience here in the room has agreed to remain silent so that we can focus on what the candidates are saying. I will invite you to applaud, however, at this moment, as we welcome the candidates: Democratic nominee for president of the United States, Hillary Clinton, and Republican nominee for president of the United States, Donald J. Trump.	(0:01:02.0)		NA	(6:04:44.70)	PM PT (pacific time zone)		(+3 hours for PM ET) 	
(0:01:09.9)	CLINTON:	How are you, Donald?	(0:01:10.6)		(6:04:52.60)					
(0:01:10.6)	TRUMP:	(INAUDIBLE)	(0:01:11.2)							
(0:01:17.0)	HOLT:	Good luck to you.	(0:01:17.6)							
(0:01:17.7)	CLINTON:	Good to see you. Thank you.	(0:01:18.3)							
(0:01:28.6)	HOLT:	Well, I don’t expect us to cover all the issues of this campaign tonight, but I remind everyone, there are two more presidential debates scheduled. We are going to focus on many of the issues that voters tell us are most important, and we’re going to press for specifics. I am honored to have this role, but this evening belongs to the candidates and, just as important, to the American people. Candidates, we look forward to hearing you articulate your policies and your positions, as well as your visions and your values. So, let’s begin. We’re calling this opening segment “Achieving Prosperity.” And central to that is jobs. There are two economic realities in America today. There’s been a record six straight years of job growth, and new census numbers show incomes have increased at a record rate after years of stagnation. However, income inequality remains significant, and nearly half of Americans are living paycheck to paycheck. Beginning with you, Secretary Clinton, why are you a better choice than your opponent to create the kinds of jobs that will put more money into the pockets of American workers?	(0:02:31.7)							
(0:02:32.1)	CLINTON:	Well, thank you, Lester, and thanks to Hofstra for hosting us. The central question in this election is really what kind of country we want to be and what kind of future we’ll build together. Today is my granddaughter’s second birthday, so I think about this a lot. First, we have to build an economy that works for everyone, not just those at the top. That means we need new jobs, good jobs, with rising incomes. I want us to invest in you. I want us to invest in your future. That means jobs in infrastructure, in advanced manufacturing, innovation and technology, clean, renewable energy, and small business, because most of the new jobs will come from small business. We also have to make the economy fairer. That starts with raising the national minimum wage and also guarantee, finally, equal pay for women’s work. I also want to see more companies do profit-sharing. If you help create the profits, you should be able to share in them, not just the executives at the top. And I want us to do more to support people who are struggling to balance family and work. I’ve heard from so many of you about the difficult choices you face and the stresses that you’re under. So let’s have paid family leave, earned sick days. Let’s be sure we have affordable child care and debt-free college. How are we going to do it? We’re going to do it by having the wealthy pay their fair share and close the corporate loopholes. Finally, we tonight are on the stage together, Donald Trump and I. Donald, it’s good to be with you. We’re going to have a debate where we are talking about the important issues facing our country. You have to judge us; who can shoulder the immense, awesome responsibilities of the presidency, who can put into action the plans that will make your life better. I hope that I will be able to earn your vote on November 8th.	(0:04:34.6)							
(0:04:35.6)	HOLT:	Secretary Clinton, thank you. Mr. Trump, the same question to you. It’s about putting money — more money into the pockets of American workers. You have up to two minutes.	(0:04:42.3)							
(0:04:42.7)	TRUMP:	Thank you, Lester. Our jobs are fleeing the country. They’re going to Mexico. They’re going to many other countries. You look at what China is doing to our country in terms of making our product. They’re devaluing their currency, and there’s nobody in our government to fight them. And we have a very good fight. And we have a winning fight. Because they’re using our country as a piggy bank to rebuild China, and many other countries are doing the same thing. So we’re losing our good jobs, so many of them. When you look at what’s happening in Mexico, a friend of mine who builds plants said it’s the eighth wonder of the world. They’re building some of the biggest plants anywhere in the world, some of the most sophisticated, some of the best plants. With the United States, as he said, not so much. So Ford is leaving. You see that, their small car division leaving. Thousands of jobs leaving Michigan, leaving Ohio. They’re all leaving. And we can’t allow it to happen any more. As far as child care is concerned and so many other things, I think Hillary and I agree on that. We probably disagree a little bit as to numbers and amounts and what we’re going to do, but perhaps we’ll be talking about that later. But we have to stop our jobs from being stolen from us. We have to stop our companies from leaving the United States and, with it, firing all of their people. All you have to do is take a look at Carrier air conditioning in Indianapolis. They left — fired 1,400 people. They’re going to Mexico. So many hundreds and hundreds of companies are doing this. We cannot let it happen. Under my plan, I’ll be reducing taxes tremendously, from 35 percent to 15 percent for companies, small and big businesses. That’s going to be a job creator like we haven’t seen since Ronald Reagan. It’s going to be a beautiful thing to watch. Companies will come. They will build. They will expand. New companies will start. And I look very, very much forward to doing it. We have to renegotiate our trade deals, and we have to stop these countries from stealing our companies and our jobs.	(0:06:51.0)							
(0:06:52.0)	HOLT:	Secretary Clinton, would you like to respond?	(0:06:53.2)							
(0:06:53.9)	CLINTON:	Well, I think that trade is an important issue. Of course, we are 5 percent of the world’s population; we have to trade with the other 95 percent. And we need to have smart, fair trade deals. We also, though, need to have a tax system that rewards work and not just financial transactions. And the kind of plan that Donald has put forth would be trickle-down economics all over again. In fact, it would be the most extreme version, the biggest tax cuts for the top percent of the people in this country than we’ve ever had. I call it trumped-up trickle-down, because that’s exactly what it would be. That is not how we grow the economy. We just have a different view about what’s best for growing the economy, how we make investments that will actually produce jobs and rising incomes. I think we come at it from somewhat different perspectives. I understand that. You know, Donald was very fortunate in his life, and that’s all to his benefit. He started his business with $14 million, borrowed from his father, and he really believes that the more you help wealthy people, the better off we’ll be and that everything will work out from there. I don’t buy that. I have a different experience. My father was a small-businessman. He worked really hard. He printed drapery fabrics on long tables, where he pulled out those fabrics and he went down with a silkscreen and dumped the paint in and took the squeegee and kept going. And so what I believe is the more we can do for the middle class, the more we can invest in you, your education, your skills, your future, the better we will be off and the better we’ll grow. That’s the kind of economy I want us to see again.	(0:08:36.6)							
(0:08:36.8)	HOLT:	Let me follow up with Mr. Trump, if I can. You’ve talked about creating 25 million jobs, and you’ve promised to bring back millions of jobs for Americans. How are you going to bring back the industries that have left this country for cheaper labor overseas? How, specifically, are you going to tell American manufacturers that you have to come back?	(0:08:53.9)							
(0:08:54.0)	TRUMP:	Well, for one thing — and before we start on that — my father gave me a very small loan in 1975, and I built it into a company that’s worth many, many billions of dollars, with some of the greatest assets in the world, and I say that only because that’s the kind of thinking that our country needs. Our country’s in deep trouble. We don’t know what we’re doing when it comes to devaluations and all of these countries all over the world, especially China. They’re the best, the best ever at it. What they’re doing to us is a very, very sad thing. So we have to do that. We have to renegotiate our trade deals. And, Lester, they’re taking our jobs, they’re giving incentives, they’re doing things that, frankly, we don’t do. Let me give you the example of Mexico. They have a VAT tax. We’re on a different system. When we sell into Mexico, there’s a tax. When they sell in — automatic, 16 percent, approximately. When they sell into us, there’s no tax. It’s a defective agreement. It’s been defective for a long time, many years, but the politicians haven’t done anything about it. Now, in all fairness to Secretary Clinton — yes, is that OK? Good. I want you to be very happy. It’s very important to me. But in all fairness to Secretary Clinton, when she started talking about this, it was really very recently. She’s been doing this for 30 years. And why hasn’t she made the agreements better? The NAFTA agreement is defective. Just because of the tax and many other reasons, but just because of the fact…	(0:10:18.9)							
(0:10:19.0)	HOLT:	Let me interrupt just a moment, but...	(0:10:20.0)							
(0:10:20.0)	TRUMP:	Secretary Clinton and others, politicians, should have been doing this for years, not right now, because of the fact that we’ve created a movement. They should have been doing this for years. What’s happened to our jobs and our country and our economy generally is — look, we owe $20 trillion. We cannot do it any longer, Lester.	(0:10:42.7)							
(0:10:42.8) 	HOLT:	Back to the question, though. How do you bring back — specifically bring back jobs, American manufacturers? How do you make them bring the jobs back?	(0:10:49.3)							
(0:10:49.3)	TRUMP:	Well, the first thing you do is don’t let the jobs leave. The companies are leaving. I could name, I mean, there are thousands of them. They’re leaving, and they’re leaving in bigger numbers than ever. And what you do is you say, fine, you want to go to Mexico or some other country, good luck. We wish you a lot of luck. But if you think you’re going to make your air conditioners or your cars or your cookies or whatever you make and bring them into our country without a tax, you’re wrong. And once you say you’re going to have to tax them coming in, and our politicians never do this, because they have special interests and the special interests want those companies to leave, because in many cases, they own the companies. So what I’m saying is, we can stop them from leaving. We have to stop them from leaving. And that’s a big, big factor.	(0:11:33.3)							
(0:11:33.5)	HOLT:	Let me let Secretary Clinton get in here.	(0:11:34.5)							
(0:11:34.3)	CLINTON:	Well, let’s stop for a second and remember where we were eight years ago. We had the worst financial crisis, the Great Recession, the worst since the 1930s. That was in large part because of tax policies that slashed taxes on the wealthy, failed to invest in the middle class, took their eyes off of Wall Street, and created a perfect storm. In fact, Donald was one of the people who rooted for the housing crisis. He said, back in 2006, “Gee, I hope it does collapse, because then I can go in and buy some and make some money.” Well, it did collapse.	(0:12:13.2)	x						
(0:12:13.4)	TRUMP:	That’s called business, by the way.	(0:12:14.7)							
(0:12:13.5)	CLINTON:	Nine million people — nine million people lost their jobs. Five million people lost their homes. And $13 trillion in family wealth was wiped out. Now, we have come back from that abyss. And it has not been easy. So we’re now on the precipice of having a potentially much better economy, but the last thing we need to do is to go back to the policies that failed us in the first place. Independent experts have looked at what I’ve proposed and looked at what Donald’s proposed, and basically they’ve said this: that if his tax plan, which would blow up the debt by over $5 trillion and would in some instances disadvantage middle-class families compared to the wealthy, were to go into effect, we would lose 3.5 million jobs and maybe have another recession. They’ve looked at my plans and they’ve said, OK, if we can do this, and I intend to get it done, we will have 10 million more new jobs, because we will be making investments where we can grow the economy. Take clean energy. Some country is going to be the clean-energy superpower of the 21st century. Donald thinks that climate change is a hoax perpetrated by the Chinese. I think it’s real.	(0:13:35.6)	x						
(0:13:35.7)	TRUMP:	I did not. I did not.	(0:13:37.1)							
(0:13:36.0)	CLINTON:	I think science is real.	(0:13:37.6)	x						
(0:13:37.3)	TRUMP:	I do not say that.	(0:13:38.1)	x						
(0:13:38.2)	CLINTON:	And I think it’s important that we grip this...	(0:13:41.3)							
(0:13:39.0)	TRUMP:	I do not say that.	(0:13:39.7)	x						
(0:13:41.6)	CLINTON:	...and deal with it, both at home and abroad. And here’s what we can do. We can deploy a half a billion more solar panels. We can have enough clean energy to power every home. We can build a new modern electric grid. That’s a lot of jobs; that’s a lot of new economic activity. So I’ve tried to be very specific about what we can and should do, and I am determined that we’re going to get the economy really moving again, building on the progress we’ve made over the last eight years, but never going back to what got us in trouble in the first place.	(0:14:13.9)							
(0:14:13.9)	HOLT:	Mr. Trump?	(0:14:14.3)							
(0:14:14.5)	TRUMP:	She talks about solar panels. We invested in a solar company, our country. That was a disaster. They lost plenty of money on that one. Now, look, I’m a great believer in all forms of energy, but we’re putting a lot of people out of work. Our energy policies are a disaster. Our country is losing so much in terms of energy, in terms of paying off our debt. You can’t do what you’re looking to do with $20 trillion in debt. The Obama administration, from the time they’ve come in, is over 230 years’ worth of debt, and he’s topped it. He’s doubled it in a course of almost eight years, seven-and-a-half years, to be semi-exact. So I will tell you this. We have to do a much better job at keeping our jobs. And we have to do a much better job at giving companies incentive to build new companies or to expand, because they’re not doing it. And all you have to do is look at Michigan and look at Ohio and look at all of these places where so many of their jobs and their companies are just leaving, they’re gone. And, Hillary, I’d just ask you this. You’ve been doing this for 30 years. Why are you just thinking about these solutions right now? For 30 years, you’ve been doing it, and now you’re just starting to think of solutions.	(0:15:33.4)							
(0:15:33.8)	CLINTON:	Well, actually that…	(0:15:34.2)							
(0:15:33.8)	TRUMP:	I will bring — excuse me. I will bring back jobs. You can’t bring back jobs.	(0:15:38.4)	x						
(0:15:38.2)	CLINTON:	Well, actually, I have thought about this quite a bit.	(0:15:41.6)	x						
(0:15:41.8)	TRUMP:	Yeah, for 30 years.	(0:15:42.6)							
(0:15:42.2)	CLINTON:	And I have — well, not quite that long. I think my husband did a pretty good job in the 1990s. I think a lot about what worked and how we can make it work again…	(0:15:52.6)	x						
(0:15:52.5)	TRUMP:	Well, he approved NAFTA…	(0:15:53.7)	x						
(0:15:52.6)	CLINTON:	… (INAUDIBLE) million new jobs, a balanced budget…	(0:15:55.8)	x						
(0:15:54.0)	TRUMP:	He approved NAFTA, which is the single worst trade deal ever approved in this country.	(0:15:58.6)	x						
(0:15:56.3)	CLINTON:	... And incomes... Incomes went up for everybody. Manufacturing jobs went up also in the 1990s, if we’re actually going to look at the facts. When I was in the Senate, I had a number of trade deals that came before me, and I held them all to the same test. Will they create jobs in America? Will they raise incomes in America? And are they good for our national security? Some of them I voted for. The biggest one, a multinational one known as CAFTA, I voted against. And because I hold the same standards as I look at all of these trade deals. But let’s not assume that trade is the only challenge we have in the economy. I think it is a part of it, and I’ve said what I’m going to do. I’m going to have a special prosecutor. We’re going to enforce the trade deals we have, and we’re going to hold people accountable. When I was secretary of state, we actually increased American exports globally 30 percent. We increased them to China 50 percent. So I know how to really work to get new jobs and to get exports that helped to create more new jobs.	(0:17:04.1)	x						
(0:17:04.1)	HOLT:	Very quickly…	(0:17:04.4)							
(0:17:04.5)	TRUMP:	But you haven’t done it in 30 years or 26 years or any number you want it to…	(0:17:07.9)							
(0:17:07.1)	CLINTON:	Well, I’ve been a senator, Donald…	(0:17:09.1)	x						
(0:17:08.7)	TRUMP:	You haven’t done it. You haven’t done it.	(0:17:10.0)	x						
(0:17:08.9)	CLINTON:	And I have been a secretary of state…	(0:17:11.6)	x						
(0:17:10.6)	TRUMP:	Excuse me.	(0:17:11.3)	x						
(0:17:11.8)	CLINTON:	And I have done a lot…	(0:17:13.7)							
(0:17:12.3)	TRUMP:	Your husband signed NAFTA, which was one of the worst things that ever happened to the manufacturing industry.	(0:17:18.4)	x						
(0:17:16.6)	CLINTON:	Well, that’s your opinion. That is your opinion.	(0:17.18.7)	x						
(0:17:18.8)	TRUMP:	You go to New England, you go to Ohio, Pennsylvania, you go anywhere you want, Secretary Clinton, and you will see devastation where manufacture is down 30, 40, sometimes 50 percent. NAFTA is the worst trade deal maybe ever signed anywhere, but certainly ever signed in this country. And now you want to approve Trans-Pacific Partnership. You were totally in favor of it. Then you heard what I was saying, how bad it is, and you said, I can’t win that debate. But you know that if you did win, you would approve that, and that will be almost as bad as NAFTA. Nothing will ever top NAFTA.	(0:17:50.5)							
(0:17:49.6)	CLINTON:	Well, that is just not accurate. I was against it once it was finally negotiated and the terms were laid out. I wrote about that in…	(0:18:01.2)	x						
(0:18:01.2)	TRUMP:	You called it the gold standard.	(0:18:02.8)							
(0:18:01.4)	CLINTON:	I wrote about- Well I hope I-	(0:18:03.6)	x						
(0:18:03.5)	TRUMP:	You called it the gold standard of trade deals.	(0:18:05.9)	x						
(0:18:05.5)	CLINTON:	And- you know what?	(0:18:06.3)	x						
(0:18:05.9)	TRUMP:	You said it’s the finest deal you’ve ever seen.	(0:18:08.4)	x						
(0:18:08.5)	CLINTON:	No.	(0:18:08.8)							
(0:18:08.7)	TRUMP:	And then you heard what I said about it, and all of a sudden you were against it.	(0:18:11.5)	x						
(0:18:11.8)	CLINTON:	Well, Donald, I know you live in your own reality, but that is not...	(0:18:15.3)							
(0:18:14.2)	TRUMP:	Oh yeah?	(0:18:14.4)	x						
(0:18:16.0)	CLINTON:	... the facts. The facts are — I did say I hoped it would be a good deal, but when it was negotiated…	(0:18:21.5)							
(0:18:21.4)	TRUMP:	Not.	(0:18:21.6)	x						
(0:18:21.6)	CLINTON:	… which I was not responsible for, I concluded it wasn’t. I wrote about that in my book…	(0:18:27.5)							
(0:18:26.0)	TRUMP:	So is it President Obama’s fault?	(0:18:27.7)	x						
(0:18:28.0)	CLINTON:	… before you even announced.	(0:18:30.7)							
(0:18:28.1)	TRUMP:	Is it President Obama’s fault?	(0:18:29.9)	x						
(0:18:31.0)	CLINTON:	Look, there are differences…	(0:18:32.2)							
(0:18:31.5)	TRUMP:	Secretary, is it President Obama’s fault?	(0:18:33.7)	x						
(0:18:32.6)	CLINTON:	There... There are different-	(0:18:34.9)	x						
(0:18:34.5)	TRUMP:	Because he’s pushing it.	(0:18:35.4)	x						
(0:18:35.4)	CLINTON:	There are different views about what’s good for our country, our economy, and our leadership in the world. And I think it’s important to look at what we need to do to get the economy going again. That’s why I said new jobs with rising incomes, investments, not in more tax cuts that would add $5 trillion to the debt.	(0:18:55.2)							
(0:18:55.2)	TRUMP:	But you have no plan.	(0:18:56.3)							
(0:18:55.7)	CLINTON:	But in educa— oh, I do.	(0:18:57.6)	x						
(0:18:57.6)	TRUMP:	Secretary, you have no plan.	(0:18:59.9)							
(0:18:58.3)	CLINTON:	In fact, I have written a book about it. It’s called “Stronger Together.” You can pick it up tomorrow...	(0:19:03.2)	x						
(0:19:02.3)	TRUMP:	Yeah. That’s about all you’ve…	(0:19:03.6)	x						
(0:19:02.8)	HOLT:	Folks, we’re going to m-	(0:19:03.6)	x						
(0:19:03.5)	CLINTON:	... at a bookstore…	(0:19:04.8)	x						
(0:19:05.5)	CLINTON:	… or at an airport near you.	(0:19:07.0)							
(0:19:07.0)	HOLT:	We’re going to move to...	(0:19:07.7)							
(0:19:07.8)	CLINTON:	But it’s because I see this — we need to have strong growth, fair growth, sustained growth. We also have to look at how we help families balance the responsibilities at home and the responsibilities at business. So we have a very robust set of plans. And people have looked at both of our plans, have concluded that mine would create 10 million jobs and yours would lose us 3.5 million jobs, and explode the debt which would have a recession.	(0:19:39.1)							
(0:19:35.3)	TRUMP:	You are going to approve one of the biggest tax cuts in history. You are going to approve one of the biggest tax increases in history. You are going to drive business out. Your regulations are a disaster, and you’re going to increase regulations all over the place. And by the way, my tax cut is the biggest since Ronald Reagan. I’m very proud of it. It will create tremendous numbers of new jobs. But regulations, you are going to regulate these businesses out of existence. When I go around — Lester, I tell you this, I’ve been all over. And when I go around, despite the tax cut, the thing — the things that business as in people like the most is the fact that I’m cutting regulation. You have regulations on top of regulations, and new companies cannot form and old companies are going out of business. And you want to increase the regulations and make them even worse. I’m going to cut regulations. I’m going to cut taxes big league, and you’re going to raise taxes big league, end of story.	(0:20:35.1)	x						
(0:20:28.5)	CLINTON:	(INAUDIBLE)	(0:20:28.8)	x						
(0:20:35.1)	HOLT:	Let me get you to pause right there, because we’re going to move into — we’re going to move into the next segment.	(0:20:38.3)							
(0:20:36.6)	CLINTON:	Yes, well. That, but let's do that-	(0:20:38.2)	x						
(0:20:38.4)	HOLT:	We’re going to talk taxes.	(0:20:39.3)							
(0:20:38.5)	CLINTON:	That can’t — that can’t be left to stand.	(0:20:40.9)	x						
(0:20:40.2)	HOLT:	Please just take 30 seconds and then we’re going to go on.	(0:20:42.5)	x						
(0:20:41.1)	CLINTON:	You know, I kind of assumed that there would be a lot of these charges and claims, and so...	(0:20:47.5)	x						
(0:20:47.4)	TRUMP:	Facts.	(0:20:47.8)	x						
(0:20:47.7)	CLINTON:	... we have taken the home page of my website, HillaryClinton.com, and we’ve turned it into a fact-checker. So if you want to see in real-time what the facts are, please go and take a look. Because what I have proposed…	(0:21:02.7)	x						
(0:21:01.5)	TRUMP:	And take a look at mine, also, and you’ll see.	(0:21:03.5)	x						
(0:21:02.8)	CLINTON:	… would not add a penny to the debt, and your plans would add $5 trillion to the debt. What I have proposed would cut regulations and streamline them for small businesses. What I have proposed would be paid for by raising taxes on the wealthy, because they have made all the gains in the economy. And I think it’s time that the wealthy and corporations paid their fair share to support this country.	(0:21:31.1)	x						
(0:21:30.8)	HOLT:	Well, you just opened the next segment.	(0:21:32.0)	x						
